{
  "$schema": "http://json-schema.org/draft-07/schema#",
  "title": "Synaptome Layer Asset",
  "description": "Permissive G0 schema for layer assets consumed by LayerLibrary.",
  "type": "object",
  "required": ["id", "label", "category", "type"],
  "additionalProperties": true,
  "properties": {
    "id": { "type": "string", "minLength": 1 },
    "label": { "type": "string", "minLength": 1 },
    "category": { "type": "string", "minLength": 1 },
    "layerGroup": { "type": "string" },
    "model": { "type": "string" },
    "stateModel": { "type": "string" },
    "type": { "type": "string", "minLength": 1 },
    "registryPrefix": { "type": "string" },
    "description": { "type": "string" },
    "opacity": {
      "type": "number",
      "minimum": 0
    },
    "defaults": {
      "type": "object",
      "additionalProperties": true
    },
    "modes": {
      "type": "array",
      "items": { "$ref": "#/definitions/mode" }
    },
    "coverage": { "$ref": "#/definitions/coverage" },
    "hudWidget": {
      "type": "object",
      "additionalProperties": true
    }
  },
  "definitions": {
    "mode": {
      "type": "object",
      "additionalProperties": true,
      "required": ["id", "label"],
      "properties": {
        "id": { "type": "string", "minLength": 1 },
        "label": { "type": "string", "minLength": 1 },
        "kind": { "type": "string" },
        "live": { "type": "boolean" },
        "description": { "type": "string" }
      }
    },
    "coverage": {
      "type": "object",
      "additionalProperties": true,
      "properties": {
        "mode": { "type": "string" },
        "columns": {
          "type": "integer",
          "minimum": 0
        }
      }
    }
  }
}
