{
  "id": "hud.controls",
  "label": "Hotkey Guide",
  "category": "HUD",
  "type": "ui.hud.widget",
  "registryPrefix": "hud.controls",
  "description": "Active keyboard, mouse, and controller shortcuts.",
  "hudWidget": {
    "module": "controls",
    "toggleId": "hud.controls",
    "defaultBand": "hud",
    "defaultColumn": 0,
    "telemetry": ["hotkeys", "conflicts"]
  }
}
