{
  "id": "generative.cosmicWeb",
  "label": "Cosmic Web",
  "category": "Generative",
  "type": "cosmicWeb",
  "registryPrefix": "generative.cosmicWeb",
  "description": "Audio-reactive stars and filaments that pulse like a large-scale cosmic structure.",
  "opacity": 1.0,
  "defaults": {
    "visible": true,
    "alpha": 1.0,
    "starCount": 360,
    "connectionDistance": 0.22,
    "maxConnections": 4,
    "filamentAlpha": 0.78,
    "filamentThickness": 1.8,
    "nodeSize": 3.6,
    "twinkle": 0.9,
    "pulseSpeed": 0.68,
    "pulseWidth": 0.11,
    "pulseDecay": 1.15,
    "fieldScale": 3.2,
    "fieldStrength": 0.16,
    "flowSpeed": 0.11,
    "turbulence": 0.36,
    "centerPull": 0.06,
    "driftX": 0.0,
    "driftY": -0.015,
    "waveformDisplacement": 0.075,
    "audioAmount": 1.0,
    "bassPull": 0.28,
    "midsTurbulence": 0.42,
    "highsTwinkle": 0.75,
    "peakPulseThreshold": 0.58,
    "pulseCooldown": 0.35,
    "audioSmoothing": 0.35,
    "xInput": 0.5,
    "yInput": 0.5,
    "autoReseed": false,
    "autoReseedEveryBeats": 64,
    "seed": 1337,
    "bgAlpha": 0.32,
    "bgR": 0.005,
    "bgG": 0.008,
    "bgB": 0.018,
    "backgroundColor": [
      0.005,
      0.008,
      0.018
    ],
    "colorR": 0.15,
    "colorG": 0.82,
    "colorB": 1.0,
    "color": [
      0.15,
      0.82,
      1.0
    ],
    "pulseR": 1.0,
    "pulseG": 0.42,
    "pulseB": 0.95,
    "pulseColor": [
      1.0,
      0.42,
      0.95
    ],
    "nodeColorR": 0.8,
    "nodeColorG": 0.96,
    "nodeColorB": 1.0,
    "nodeColor": [
      0.8,
      0.96,
      1.0
    ]
  }
}
