{
  "id": "generative.galaxySpiral",
  "label": "Galaxy Spiral",
  "category": "Generative",
  "type": "galaxySpiral",
  "registryPrefix": "generative.galaxySpiral",
  "description": "Audio-reactive spiral galaxy with arms, dust, core glow, and peak-driven radial pulses.",
  "opacity": 1.0,
  "defaults": {
    "visible": true,
    "alpha": 1.0,
    "starCount": 1400,
    "arms": 4,
    "radius": 0.92,
    "coreRadius": 0.16,
    "armTightness": 3.4,
    "armWidth": 0.42,
    "inclination": 0.72,
    "rotationSpeed": 0.018,
    "starSize": 1.45,
    "starBrightness": 1.2,
    "dustAlpha": 0.32,
    "coreGlow": 0.72,
    "twinkle": 0.8,
    "audioAmount": 1.0,
    "bassExpansion": 0.42,
    "midsTwist": 0.9,
    "highsSparkle": 1.35,
    "waveformWarp": 0.075,
    "peakPulseThreshold": 0.62,
    "pulseCooldown": 0.32,
    "pulseSpeed": 0.86,
    "pulseWidth": 0.12,
    "pulseStrength": 1.0,
    "audioSmoothing": 0.36,
    "seed": 4242,
    "bgAlpha": 0.55,
    "bgR": 0.004,
    "bgG": 0.006,
    "bgB": 0.018,
    "backgroundColor": [
      0.004,
      0.006,
      0.018
    ],
    "starR": 0.46,
    "starG": 0.78,
    "starB": 1.0,
    "starColor": [
      0.46,
      0.78,
      1.0
    ],
    "coreR": 1.0,
    "coreG": 0.72,
    "coreB": 0.34,
    "coreColor": [
      1.0,
      0.72,
      0.34
    ],
    "dustR": 0.58,
    "dustG": 0.24,
    "dustB": 0.88,
    "dustColor": [
      0.58,
      0.24,
      0.88
    ],
    "pulseR": 0.92,
    "pulseG": 0.38,
    "pulseB": 1.0,
    "pulseColor": [
      0.92,
      0.38,
      1.0
    ]
  }
}
