{
  "id": "generative.cosmosFormation",
  "label": "Cosmos Formation",
  "category": "Generative",
  "type": "cosmosFormation",
  "registryPrefix": "generative.cosmosFormation",
  "description": "Cosmic web simulation: dense nodes, branching filaments, dark voids, subtle local swirl, and audio-reactive starbirth.",
  "opacity": 1.0,
  "defaults": {
    "visible": true,
    "alpha": 1.0,
    "particleCount": 1800,
    "clusterCount": 64,
    "radius": 1.28,
    "originRadius": 0.018,
    "expansionRate": 0.42,
    "expansionForce": 0.45,
    "autoAdvance": false,
    "formationAge": 1.0,
    "formationTime": 90.0,
    "evolutionSpeed": 0.16,
    "gravity": 0.10,
    "gravityDelay": 0.90,
    "gravityEmergence": 0.18,
    "clusterSwirl": 0.10,
    "clusterSpread": 1.20,
    "clusterDrift": 0.04,
    "clusterSoftness": 1.08,
    "substructureAmount": 0.82,
    "substructureScale": 0.48,
    "substructureGlow": 0.95,
    "shear": 0.12,
    "voidPressure": 0.42,
    "turbulence": 0.46,
    "coolingRate": 0.34,
    "fieldLuminosity": 2.30,
    "glowPersistence": 0.945,
    "filamentMemory": 0.955,
    "matterSize": 0.55,
    "matterGlow": 1.65,
    "trailAlpha": 0.018,
    "trailThickness": 0.42,
    "haloAlpha": 0.62,
    "haloRadius": 0.145,
    "shockwaveCount": 0,
    "shockwaveAlpha": 0.0,
    "shockwaveWidth": 0.075,
    "shockwaveSpeed": 0.74,
    "pressureAmount": 0.0,
    "audioAmount": 1.0,
    "audioAccretion": 0.78,
    "audioGlow": 1.15,
    "audioTwinkle": 1.10,
    "bassExpansion": 0.22,
    "midsTurbulence": 0.36,
    "highsSparkle": 0.70,
    "waveformWarp": 0.030,
    "peakBangThreshold": 0.74,
    "peakImpulse": 0.14,
    "beatImpulse": 0.025,
    "audioSmoothing": 0.35,
    "bang": false,
    "reseed": false,
    "seed": 2026,
    "bgAlpha": 0.72,
    "bgR": 0.004,
    "bgG": 0.006,
    "bgB": 0.018,
    "backgroundColor": [
      0.004,
      0.006,
      0.018
    ],
    "hotR": 1.0,
    "hotG": 0.70,
    "hotB": 0.30,
    "hotColor": [
      1.0,
      0.70,
      0.30
    ],
    "matterR": 0.48,
    "matterG": 0.82,
    "matterB": 1.0,
    "matterColor": [
      0.48,
      0.82,
      1.0
    ],
    "coolR": 0.13,
    "coolG": 0.38,
    "coolB": 0.95,
    "coolColor": [
      0.13,
      0.38,
      0.95
    ],
    "clusterR": 0.95,
    "clusterG": 0.36,
    "clusterB": 1.0,
    "clusterColor": [
      0.95,
      0.36,
      1.0
    ],
    "waveR": 0.72,
    "waveG": 1.0,
    "waveB": 0.86,
    "waveColor": [
      0.72,
      1.0,
      0.86
    ]
  }
}
