{
  "id": "hud.sensors",
  "label": "Connected Devices",
  "category": "HUD",
  "type": "ui.hud.widget",
  "registryPrefix": "hud.sensors",
  "description": "Runtime device connection summary for cameras, MIDI, audio, OSC, and sensor buses.",
  "hudWidget": {
    "module": "connectedDevices",
    "toggleId": "hud.sensors",
    "defaultBand": "hud",
    "defaultColumn": 1,
    "telemetry": ["devices", "midi", "audio", "osc"]
  }
}
