{
  "id": "generative.bigBang",
  "label": "Big Bang",
  "category": "Generative",
  "type": "bigBang",
  "registryPrefix": "generative.bigBang",
  "description": "Audio-reactive expansion, collapse, shock shells, filaments, and dust forming into a galaxy.",
  "opacity": 1.0,
  "defaults": {
    "visible": true,
    "alpha": 1.0,
    "particleCount": 720,
    "shellCount": 7,
    "expansionRate": 0.18,
    "expansionPower": 0.58,
    "collapse": 0.42,
    "radius": 0.93,
    "coreRadius": 0.055,
    "galaxySpin": 1.15,
    "swirl": 0.64,
    "turbulence": 0.24,
    "gravity": 0.18,
    "dustSize": 2.1,
    "dustGlow": 2.8,
    "trailAlpha": 0.42,
    "trailThickness": 1.1,
    "filamentAlpha": 0.34,
    "filamentStride": 5,
    "shellAlpha": 0.58,
    "shellThickness": 2.2,
    "shockwaveCount": 4,
    "shockwaveWidth": 0.045,
    "audioAmount": 1.0,
    "bassExpansion": 0.34,
    "midsTurbulence": 0.45,
    "highsSparkle": 0.9,
    "waveformRipple": 0.08,
    "peakBurstThreshold": 0.62,
    "peakImpulse": 0.75,
    "beatImpulse": 0.22,
    "audioSmoothing": 0.35,
    "seed": 2026,
    "bgAlpha": 0.26,
    "bgR": 0.006,
    "bgG": 0.005,
    "bgB": 0.014,
    "backgroundColor": [
      0.006,
      0.005,
      0.014
    ],
    "coreR": 1.0,
    "coreG": 0.76,
    "coreB": 0.36,
    "coreColor": [
      1.0,
      0.76,
      0.36
    ],
    "dustR": 0.5,
    "dustG": 0.82,
    "dustB": 1.0,
    "dustColor": [
      0.5,
      0.82,
      1.0
    ],
    "shellR": 1.0,
    "shellG": 0.32,
    "shellB": 0.92,
    "shellColor": [
      1.0,
      0.32,
      0.92
    ],
    "filamentR": 0.32,
    "filamentG": 1.0,
    "filamentB": 0.72,
    "filamentColor": [
      0.32,
      1.0,
      0.72
    ]
  }
}
