{
  "id": "generative.solarSystem",
  "label": "Solar System",
  "category": "Generative",
  "type": "solarSystem",
  "registryPrefix": "generative.solarSystem",
  "description": "Seeded low-poly scientific orrery driven by observed exoplanet system data, with a radiating host star, stable elliptical orbits, subtle trails, moons, rings, asteroid belts, rare comets, and heliosphere field lines.",
  "opacity": 1.0,
  "defaults": {
    "visible": true,
    "showOrbits": true,
    "showTrails": true,
    "showMoons": true,
    "showRings": true,
    "showAsteroids": true,
    "showComets": true,
    "showWaveformBelt": true,
    "showCallouts": true,
    "calloutCompact": false,
    "alpha": 1.0,
    "calloutAlpha": 0.88,
    "calloutBackgroundAlpha": 0.82,
    "calloutScale": 0.92,
    "scale": 0.92,
    "sceneZoom": 1.0,
    "orbitSpread": 1.32,
    "orbitSpeed": 0.012,
    "orbitTilt": 26.0,
    "orbitRotation": -18.0,
    "orbitPlaneVariation": 0.90,
    "eccentricity": 0.55,
    "depth": 1.0,
    "starSize": 0.07,
    "starGlow": 3.0,
    "starRadiance": 2.8,
    "starEmissionAudio": 1.35,
    "starSurfaceTurbulence": 0.82,
    "solarBurstIntensity": 0.90,
    "sideFillLight": 0.34,
    "visitorEvents": 0.55,
    "artifactActivity": 0.65,
    "planetSize": 0.62,
    "observedDiversity": 0.0,
    "planetVariation": 0.28,
    "asteroidDensity": 0.65,
    "cometDensity": 0.25,
    "orbitAlpha": 0.12,
    "orbitThickness": 0.85,
    "trailAlpha": 0.36,
    "trailLength": 0.30,
    "trailSteps": 56,
    "trailStampGain": 0.85,
    "trailStampLife": 5.5,
    "atmosphereGrowth": 0.95,
    "lifeReactivity": 1.20,
    "biosphereThreshold": 0.46,
    "civilizationGrowth": 0.64,
    "moonSize": 0.45,
    "moonSpeed": 0.35,
    "audioAmount": 0.65,
    "audioSmoothing": 0.32,
    "bassScale": 0.75,
    "midsSpeed": 0.36,
    "highsSparkle": 0.70,
    "waveformAmount": 0.045,
    "bgAlpha": 0.28,
    "bgR": 0.004,
    "bgG": 0.006,
    "bgB": 0.018,
    "backgroundColor": [
      0.004,
      0.006,
      0.018
    ],
    "starR": 1.0,
    "starG": 0.72,
    "starB": 0.24,
    "starColor": [
      1.0,
      0.72,
      0.24
    ],
    "orbitR": 1.0,
    "orbitG": 1.0,
    "orbitB": 1.0,
    "orbitColor": [
      1.0,
      1.0,
      1.0
    ],
    "trailR": 1.0,
    "trailG": 1.0,
    "trailB": 1.0,
    "seed": 0,
    "trailColor": [
      1.0,
      1.0,
      1.0
    ]
  }
}
