{
  "id": "generative.arcticSeaIcebergs",
  "label": "Arctic Sea Icebergs",
  "category": "Generative",
  "type": "arcticSeaIcebergs",
  "registryPrefix": "generative.arcticSeaIcebergs",
  "description": "Neon arctic sea foreground with depth-scaled icebergs, horizon haze, aurora reflections, audio-reactive waves, and subtle outrun accents.",
  "opacity": 1.0,
  "defaults": {
    "visible": true,
    "alpha": 1.0,
    "seaLevel": 0.66,
    "waterDepth": 0.34,
    "horizonGlow": 0.58,
    "reflectionStrength": 0.72,
    "waveAmplitude": 0.44,
    "waveFrequency": 7.5,
    "perspectiveLines": 0.46,
    "icebergCount": 8,
    "icebergScale": 1.0,
    "driftSpeed": 0.030,
    "rimLight": 0.78,
    "magentaAccent": 0.34,
    "sparkleAmount": 0.48,
    "peakBloom": 0.50,
    "bassWaves": 0.85,
    "midsDrift": 0.52,
    "highsSparkle": 0.90,
    "audioAmount": 0.82,
    "audioSmoothing": 0.48,
    "seed": 7331,
    "waterR": 0.012,
    "waterG": 0.045,
    "waterB": 0.110,
    "waterColor": [
      0.012,
      0.045,
      0.110
    ],
    "rimR": 0.10,
    "rimG": 0.86,
    "rimB": 1.0,
    "rimColor": [
      0.10,
      0.86,
      1.0
    ],
    "accentR": 0.88,
    "accentG": 0.18,
    "accentB": 0.86,
    "accentColor": [
      0.88,
      0.18,
      0.86
    ],
    "auroraR": 0.08,
    "auroraG": 1.0,
    "auroraB": 0.48,
    "auroraColor": [
      0.08,
      1.0,
      0.48
    ]
  }
}
