{
  "id": "generative.oscilloscope",
  "label": "Oscilloscope",
  "category": "Generative",
  "type": "oscilloscope",
  "registryPrefix": "generative.oscilloscope",
  "opacity": 1.0,
  "defaults": {
    "signalMode": 0,
    "triggerSync": true,
    "waveformGain": 1.6,
    "waveformMix": 0.75,
    "waveformDelay": 12,
    "waveformSmoothing": 0.3,
    "waveformPersistence": 0.65,
    "pattern": 1,
    "modMode": 1,
    "xInput": 0.0,
    "yInput": 0.0,
    "speedInput": 0.0,
    "baseAmount": 1.0,
    "modAmount": 0.55,
    "radialAmount": 0.45,
    "wiggleAmount": 0.22,
    "amplitude": 0.8,
    "speed": 1.0,
    "speedModAmount": 0.75,
    "freqX": 0.8,
    "freqY": 1.0,
    "phaseOffsetDeg": 90.0,
    "morph": 0.4,
    "showGrid": true,
    "showCrosshair": true,
    "showGlow": true,
    "gridDivisions": 4,
    "gridAlpha": 0.18,
    "glowAlpha": 0.18,
    "glowRadius": 1.05,
    "glowFalloff": 0.65,
    "xScale": 1.0,
    "yScale": 1.0,
    "xBias": 0.0,
    "yBias": 0.0,
    "rotationDeg": 0.0,
    "historySize": 256,
    "sampleDensity": 4,
    "thickness": 3.5,
    "alpha": 0.9,
    "decay": 0.65,
    "intensity": 1.0,
    "pointSize": 3.0,
    "color": [
      0.25,
      1.0,
      0.55
    ],
    "backgroundColor": [
      0.02,
      0.08,
      0.05
    ]
  }
}
